review,score,game_id
"Throne and Liberty is a full-fledged next-gen RPG thanks to both his impactful visual style as well as an incredibly polished gameplay. The game sets whole new standards for the genre, hence looking like a promising future is ahead. Now it is time to see if Throne and Liberty can truly shine on its own.",0.88,7
"Like most MMORPGs, the fate of Throne and Liberty will rely heavily on the decisions NCSoft and Amazon Games make in regard to future content. Nothing beats a solid MMORPG launch; and so far, at least the Early Access launch has been incredibly smooth. But the ability to keep meaningful and fun content coming is what keeps players logging in and overall making the MMO feel worth playing. In its current state, you’ll be hard-pressed to find an F2P MMORPG with as much content and polish as Throne and Liberty. If you’ve been looking for something that puts the MMO back into MMORPG, this could be just what you’re looking for.",0.85,7
"Throne and Liberty meets expectations by combining aspects from other games with its own special style. It's unique because we get to create a character with any class to play as we like. From level 1 to 30, the experience is excellent but the ""End Game"" stuff promise something good but we never know. On the other hand the learning curve can be overwhelming, but NCSoft has achieved something positive, and i hope that players will adapt to this game or we will stop hearing about it in 2 weeks. ",0.83,7
"Throne and Liberty would undoubtedly have required a few more months of development to correct the many bugs that plague new players. The universe is clean, the interface and icons are neat, progression is sound and the gameplay is fluid and dynamic. Of course, Throne and Liberty won't be able to compete with the premium tenors of the MMO genre any time soon. But it's got everything it takes to make its mark, with a dynamic open world at its heart, which requires you to exist within it, rather than serve as a dumb launching pad for leveling.",0.8,7
"Throne and Liberty presents itself as an ambitious and risky proposal to encompass a classic traditional RPG concept with new, more dynamic mechanics and top-notch visuals. The storyline is full of stereotypes, but it’s enjoyable, providing an adventure that includes a massive tutorial to cover various PvP and PvE game modes. It’s a universe to get lost in, but where modern mechanics, giving rewards too quickly, could carry the user to an end where only finds a monotony experience too soon.",0.75,7
"The game’s world is just gorgeous, lovingly put together, and more than that, is built to the scale of a proper MMO worth your time to try for the price of free. I can very much see Throne and Liberty finding its fans for the things it does well even if it isn’t sweepingly innovative for the genre as a whole, and that’s more than you can say for a lot of new MMOs and MMO-adjacent titles.",0.7,7
"I have no doubt that Throne and Liberty will find a niche in the MMO community that it somehow speaks to. And I’m happy for those people that they will find something to enjoy here. But for most players, I don’t think Throne and Liberty will have anything valuable.",0.3,7
"Looking for a new MMO? Throne and Liberty is an easy one to pick up and might just sway genre newcomers, too. I’m not entirely convinced it does anything too different from genre norms, but what it does, it does with a level of polish seldom seen, particularly at this early stage. Will it challenge the heavy hitters? Right now, it’s too early to tell, but it’s off to a good start. [Review in Progress]",-0.01,7
"But the lackluster story and the unrealized potential of certain mechanics will likely remain that way for some time. They could be expanded on in later updates, but in their present state, they don’t do enough to elevate Throne and Liberty over similar games in the genre. Most MMO players are pretty entrenched in their favorite games. When a new title comes along, it has to offer something special enough to draw players away from their current obsessions...Throne and Liberty doesn't do that, at least not yet. The introduction of multiplayer will certainly force me to reevaluate my experience, but for now, I prefer to look at Throne and Liberty as a fledgling MMO that’s laid a lot of good groundwork, but still has a long way to go. [Review in Progress]",-0.01,7
"There’s a real promise in what stands to be a modern successor to one of the all-time greats of the genre, NCSoft’s Lineage 2. [Review in Progress]",-0.01,7
"While Breath of the Wild and Tears of the Kingdom successfully brought exciting new concepts to Nintendo's iconic series and helped revolutionize open-world games – Echoes of Wisdom feels like a big step forward for classic Zelda. The game is a punchy cocktail of old school Zelda, expertly blended with modern mechanics from the series’ two open-world giants. As a result, Nintendo has created something that feels both nostalgic and uniquely fresh…It may have taken 38 years for the series's titular princess to finally get her own game, but boy was it worth waiting for. Echoes of Wisdom not only demonstrates that Nintendo is capable of wowing Zelda fans, but it can breathe new life into its legendary series. Echoes of Wisdom is a resounding success, a masterclass in creativity, and a worthy debut title for the series’ legendary princess.",1.0,6
"The Legend of Zelda: Echoes of Wisdom is the perfect Legend of Zelda game. Where Breath of the Wild and Tears of the Kingdom took the series in new directions, to the point that they're barely related to what came before them, Zelda’s first outing as a protagonist feels like it fits seamlessly in with the traditions of Ocarina of Time, Link’s Awakening and Link to the Past. Not only that, but Nintendo has built a gameplay system that is more whimsical and creative than any of those previous titles, making this a more complete and fully realised vision of what the series has always wanted to be. I desperately hope that this wasn’t just a one-off experiment, and The Legend of Link is here to stay.",1.0,6
"The Legend of Zelda: Echoes of Wisdom features all of the amazing hallmarks of the series, yet feels completely innovative, unique, and fresh.",1.0,6
"Long-time Zelda players will be smiling from ear to ear when they roll credits. The Legend of Zelda: Echoes of Wisdom is full of wonderful surprises, engaging gameplay, and tons of stuff to do in the biggest top-down iteration of Hyrule yet.",1.0,6
"The perfect evolution for the Zelda series. It feels, in every way, like this is Zelda’s story, and this game does a great job of proving that there are many different ways to be a hero.",1.0,6
"Echoes of Wisdom is a great send-off to The Legend of Zelda's most successful era. The game is the ending point for a very clear path started by Breath of the Wild and continued in Tears of The Kingdom, of games that have an unyielding faith in the player's ability to solve problems in very creative ways. All of that is combined with the structure of classic 2D-era Zelda games.",1.0,6
"You’ll find yourself quickly and expertly tossing pots to distract baddies, stacking boxes and tables for extra height and firing out little green critters to fight for you, while you run around enemies to escape. It’s a joy to play, looks great and an excellently crafted mashup of gaming ideas to deliver a fresh-feeling new Zelda.",1.0,6
"The Legend of Zelda: Echoes of Wisdom has managed to surprise me by mixing the limitless creativity that the 3D games of the franchise have been offering with the classic flavor of the two-dimensional Zelda games. Playing as Princess Zelda is a breath of fresh air, and mechanics such as creating Echoes or Bind give room for many possibilities.",0.97,6
"The Legend of Zelda: Echoes of Wisdom elegantly bridges old and new Zelda with grace and gusto. The Echoes system is inventive, the dungeon designs are strong and the whole experience feels like everything a classic Zelda experience should be. While minor performance issues hold Echoes of Wisdom back from being everything it could be, they're only minor blemishes on an otherwise stellar adventure fit for a princess.",0.95,6
"The Legend of Zelda: Echoes of Wisdom feels like the perfect compromise between old and new. It incorporates some of the best elements of open-world design from the more recent 3D titles into the solid linear structures of the classic 2D instalments to create something that feels familiar without being too stale, and structured without being restrictive. No matter what your history with the series is, you’d be wise to check this one out. The Legend of Zelda: Echoes of Wisdom launches for Nintendo Switch on 26 September 2024.",0.95,6
"The Legend of Zelda: Echoes of Wisdom is a game with a considerably smaller scale than the last two installments in the series and therefore, with much more earthly goals and objectives, however, Grezzo brings to the table a title with a lot of proposal that knew perfectly how to mix the whole new philosophy of the franchise, with its oldest and most beloved traditions by fans. This opens a completely new line of thought that tells us that smaller-sized The Legend of Zelda also have a place in the future. Needless to say, we are facing one of the great video games of this very strong 2024, one that of course, you shouldn't miss for anything.",0.95,6
"Echoes of Wisdom offers a variety of clever puzzles that go hand in hand with its excellent gameplay and charming story, which looks and feels like it came straight out of a cozy fairytale. It's nothing short of a highly memorable and fulfilling experience.  ",0.95,6
"Anarchic, exciting and at times ingenious: The Legend of Zelda Echoes of Wisdom is an adventure that will test your brains without overstressing your fingertips. It doesn't last long and hardcore gamers will perhaps complete it too quickly, but the journey is sensational and enveloped in the usual ‘made in Nintendo’ magic that makes it a must-have in any case.",0.93,6
The Legend of Zelda: Echoes of Wisdom reclaims the relevance of the games with this perspective within the franchise. Leaving Link aside allows us to play a fresh formula that at the same time remains recognizable.,0.92,6
The Legend of Zelda: Echoes of Wisdom cleverly combines the format of classic installments with the style of modern ones; a link between the past and the future of the saga that also brings home-grown ideas full of possibilities and freshness. The princess has shown why she has always been HER legend.,0.91,6
"The Legend of Zelda: Echoes of Wisdom is the twist on the old Zelda formula that we've been craving. Classic systems like a large number of dungeons are still present, while the magic system makes for an incredible array of solutions to your problems. The named downsides, like the unintuitive item menu and the framedrops, are annoying, but otherwise do not bother this solid game.",0.9,6
"It may have taken nearly four decades, but the first mainline Zelda game with the titular princess in the lead role was worth the wait. This is a magnificent adventure that whizzes and pops with imagination, and proudly stands shoulder to shoulder with the very best of Link’s tales. If this is the Switch’s final Zelda game - and surely it has to be - then we’re going out on a high.",0.9,6
"The Legend of Zelda: Echoes of Wisdom is a gorgeous, brilliantly clever game in a series that continues to be unique and innovative.",0.9,6
"The Legend of Zelda: Echoes of Wisdom proves that a classic approach to the series is still possible as long as it only partially negates the evolutions of recent years. The new gameplay mechanics blend perfectly with the old-school structure and are fun, while the art direction takes your breath away.",0.9,6
"The new Zelda game, where you finally play as Zelda, offers an unexpectedly grand adventure, blending the best of the series' 2D titles with crafting-like mechanics inspired by Tears of the Kingdom. Echoes of Wisdom is more than a spin-off or mish-mash of previous concepts – it’s a well-crafted, refreshing addition to the legendary series.",0.9,6
"Where Link’s Awakening already looked fantastic and sounded even better, The Legend of Zelda: Echoes of Wisdom has all of that, but with a unique gameplay concept on top. The ability to learn and copy objects and enemies adds so much more depth than you might expect at first glance. It seems like multiple solutions are possible for everything, and you might have a completely different approach to most of the game than I do. Selecting the Echoes is somewhat awkward, and this user interface is the biggest criticism I have of the game. By limiting direct combat, you’re forced to think differently, and in most cases, this works out well, though it can be frustrating at times. Beyond that, you’ll find a wonderfully traditional Zelda adventure full of secrets, great dungeons, and boss fights, but filled with small environment-based puzzles and challenges.",0.9,6
"Subverting the franchise's standard narrative, Echoes of Wisdom sets the titular princess out to save the kingdom - and Link - from the forces of evil. Even without wielding a sword and shield at all times, Zelda uses the greatest weapon she possesses: wisdom, and there's nothing more “Zelda” than that.",0.9,6
"Nintendo reimagines The Legend of Zelda series by using Zelda herself, creating an adventure very different from those of Link. It's clever and rewarding, offering almost complete freedom to experiment and turning this ""classic Zelda"" into a revolution of 2D sandbox games.",0.9,6
"The Legend of Zelda: Echoes of Wisdom should be the new standard for top-down Zelda going forward. Rather than abandoning the classic formula, Zelda has shown that the old and the new can come together and produce wonderful results that reward experimentation and reinforce the joy of play. This is easily in contention with A Link to the Past and A Link Between Worlds as one of the best top-down adventures in the series, and we hope we don’t need to wait another 35 years for Zelda to take a starring role again.",0.9,6
"The Legend of Zelda: Echoes of Wisdom gives Princess Zelda a starring role, combining new and classic elements to deliver an inventive title that's one of the most delightful in the series yet.",0.9,6
"The Legend of Zelda: Echoes of Wisdom gives the princess a worthy game, with a brilliant gameplay mechanic that, despite technical flaws, stimulates your brain in a classic way.",0.9,6
"Even with this overabundance of options, and even considering the technical limitations and simplicity mentioned above, it's hard not to play Echoes of Wisdom and think, ""This is what I've been waiting for.",0.9,6
The Legend of Zelda Echoes of Wisdom is a unique new addition to the Zelda family. It’s wonderful to see the same boundless creativity celebrated in a smaller-scale title.,0.9,6
"The Legend of Zelda: Echoes of Wisdom may not be a game for everyone. Maybe not even a game for every Zelda fan. It does things differently, turns the traditional formula on its head and asks you to do something other than traditional combat. But that's what impressed me about it. It's not trying to do the same thing that worked five years ago. It's building on that, but it's doing something new, something fresh and something interesting that's hard to tear yourself away from.",0.9,6
"The Legend of Zelda: Echoes of Wisdom brings some new ideas to the table, but in the end, the game is more about modernizing the classic 2D Zelda experience. The attention-grabbing echo copying mechanic has its pros and cons, but where Echoes of Wisdom consistently hits is in the tried-and-true design of its world and dungeons, which are as good as any the franchise has delivered in the past. This may be Zelda's first starring adventure, but past Legends still echo strongly here.",0.9,6
"The Legend of Zelda: Echoes of Wisdom is the Zelda game I’ve always wanted, putting Hyrule’s princess into the thick of it for the first time and coming up with incredible results. The gameplay loop is phenomenal, the story is lovely, and with any luck this will be the first of many adventures for the Zelda series’ leading lady. ",0.9,6
"If Zelda's debut in the spotlight is a one-off, at least it's a memorable adventure. But hopefully this is the beginning of a new legend for the heroine. Echoes of Wisdom's brilliantly integrates echoes system links two eras, proving that the freeform mechanics of the new age can coexist with the franchise's classic formula. Don't mistake this for a spin-off or minor entry between big ""mainline"" games: The Legend of Zelda: Echoes of Wisdom is a major moment that shouldn't be missed.",0.9,6
"Ultimately, The Legend of Zelda: Echoes of Wisdom can be considered a successful experiment. Playing as the princess is not only genuinely fun, but it offers a new perspective on the entire imaginary of the kingdom of Hyrule. The mechanics of the replicas interact perfectly with the possibility of seeing Zelda in the role of swordswoman, while the ideas related to physical principles further enrich the gameplay. In Echoes of Wisdom, male and female players can adopt the approach they prefer, favoring exploration, use of ingenuity or use of bizarre weapons, equipment and accessories. An excellent adventure, which with a more refined artistic sector and a greater refinement of interfaces and technical aspects could have been a complete masterpiece. If you have a Nintendo Switch on your home table, however, The Legend of Zelda: Echoes of Wisdom is a very valid reason to grab the joy-con and enjoy the genuine fun offered by the kingdom of Hyrule.",0.9,6
"The Legend of Zelda: Echoes of Wisdom doesn't quite manage to deliver the level of freedom seen in 3D entries like Tears of the Kingdom, but it's hard to complain about some rigid puzzle elements when the game has opened things up so much. Clearly, Nintendo's developers are looking for ways to blend the new and old, and this is another part of that journey. The Echo system is a pleasure to use, the world is more attractive than the last Zelda game, and there's a lot of content in this package. The result is a 2D Zelda game perfectly tailored for fans that first discovered the series with Breath of the Wild. That said, whether you're a longtime Zelda fan, or someone newer to the series, Echoes of Wisdom is a bold step forward for the 2D entries in the franchise. It took decades for Zelda to have a great game to call her own, but the result is worth celebrating. ",0.9,6
"The Legend of Zelda: Echoes of Wisdom is far more than some second-tier spinoff, combining the expertly crafted dungeons and item progression you’d expect from a 2D Zelda with the wild creativity provided by Tears of the Kingdom.",0.9,6
"On almost every level, The Legend of Zelda: Echoes of Wisdom is a delight. Its art style begs for your attention at every turn and I couldn’t get enough of the Echoes system, always eager to explore new combinations to overcome the next challenge. Given the dramatic shift that Breath of Wild brought to the series, Echoes of Wisdom feels like the perfect answer in kind for the top-down Zelda titles, expanding the gameplay in a whole new way whilst maintaining the core look of the franchise so that existing fans don’t feel too isolated. It may have taken a long time for Zelda to star in the leading role, but for it to finally come about in Echoes of Wisdom, the wait was most certainly worth it.",0.9,6
"A perfectly-paced, delightful twist on the classic 2D Zelda formula, The Legend of Zelda: Echoes of Wisdom takes everything Nintendo has learned from the Switch era and condenses it into a tight adventure jam-packed with heart. Through its wonderfully magical Echoes mechanic, satisfyingly diverse dungeon design, and unique blend of modern and classic design elements, this is both a celebration of the franchise’s history and a bold first offering for Zelda as protagonist. Performance issues aside, Echoes of Wisdom is impossible not to love for newcomers and series veterans alike.",0.9,6
"After Princess Peach’s turn in the spotlight, Princess Zelda readily demonstrates that she is more than capable of saving her own kingdom. Grezzo should be incredibly proud of what they have achieved here, delivering a complete reinvention of what awaits us in a top-down adventure across the kingdom of Hyrule with an experience in which past and present collide that succeeds in repeatedly subverting your expectations.",0.9,6
"Echoes of Wisdom is an exemplary game. It has completely obliterated the limitations of the old top-down Zelda formula and will have huge gameplay ramifications for the next generation of Legend of Zelda games, whatever form they take (Zelda Maker seems so obvious). It’s heartbreaking to see some control oversights and the glossy plastic art direction hampered slightly by the technical wobbles. I barely cared, though. I just wonder how I’ll be able to go back to the overhead adventures of the little green-hooded twink after this. ",0.9,6
Echoes of Wisdom is a marvel both visually and gameplay-wise. It's riddled with clever puzzles and gives you total freedom to choose to save Hyrule in your own way. An outstanding experience marred only by a few usability issues.,0.9,6
The Legend of Zelda: Echoes of Wisdom brings a delightful entry to the classic franchise with Princess Zelda as the leading lady. Use your wits and a catalog of echoes in an incredibly well-rounded game to rediscover every corner of Hyrule in a new story.,0.9,6
"This is the best '2D' The Legend of Zelda in recent decades: it offers an adventure of rare charm and overflowing creativity, giving the player great freedom without ever losing sight of the intuitiveness of the mechanics, and without allowing them the ability to undermine the meticulous level design of the game. The bold hybridization between the classic formula and the open-air approach could shape the future of the series.",0.9,6
Quotation forthcoming.,0.9,6
"The Legend of Zelda: Echoes of Wisdom offers an excellent, classic Zelda game experience. The main idea of the game is very fun, as it gives players unlimited options in how to tackle the puzzles and confront enemies; You will not find two players playing the game in the same way.",0.9,6
"Nintendo takes a bold step by making Zelda the central playable character, introducing fresh mechanics that distinguish the game from previous entries in the series. While the story lacks surprises and the Echo selection menu can be frustrating, the game excels with creative puzzles, engaging combat, and flexibility that caters to both series fans and newcomers.",0.9,6
"The Legend of Zelda: Echoes of Wisdom offers a fresh perspective on the series, boldly blending traditional elements with modern innovations while finally giving Princess Zelda the lead role. Her unique abilities bring a new layer of creativity to puzzle-solving and combat, encouraging exploration with inventive solutions. Despite minor technical issues and a cluttered Echoes menu, this new Zelda installment takes the franchise in a promising direction.",0.9,6
"The Legend of Zelda: Echoes of Wisdom is a lovely way to return to Hyrule, and the echo system revitalizes the experience of exploring this world. From combat to exploration, your approaches will be wildly different from any Zelda game before, and that’s what makes Echoes of Wisdom worth playing. While it’s not quite a Zelda masterpiece, it’s definitely an essential Nintendo Switch game.",0.9,6
"The Legend of Zelda: Echoes of Wisdom presents us with an adventure that we will remember for a long time, where Princess Zelda is the protagonist, and you will rely on your wit to navigate dungeons in multiple ways. This kind of freedom is changing TLOZ into a gaming offering that anyone can enjoy.",0.9,6
"Echoes of Wisdom is a great maiden adventure for Zelda, marrying old and new convincingly, and setting up a foundation for 2D Zelda games to thrive alongside their bigger 3D cousins.",0.9,6
"The Legend of Zelda: Echoes of Wisdom is simply delightful and is how every top-down Zelda game should feel like. It’s not huge in the scale of Tears of the Kingdom in size or depth, but it still manages to give you plenty of hours of fun, exploration, and wonder that make it an influential entry in the Legend of Zelda series.",0.9,6
Echoes of Wisdom is yet another stunning entry in the Zelda franchise and those looking for a new Zelda experience but also clamour for something different should give this title a definite try.,0.9,6
The Legend of Zelda: Echoes of Wisdom blends Zelda tradition and modernity into an all-round harmonious and beautiful package.,0.88,6
"To get a game this innovative, charming and polished over a year after the remarkable “Tears” is miraculous.",0.88,6
"The Legend of Zelda: Echoes of Wisdom has the potential to become a whole new series on its own thanks to the many possibilities that Zelda introduces as the main character, both narratively and gameplay-wise. It may not be the most ambitious entry in the franchise, and it definitely has some flaws, but even so there's a very big chance for The Legend of Zelda: Echoes of Wisdom to become a fan favorite game.",0.87,6
"While the world and story of Echoes of Wisdom are a lot like what you're used to seeing when playing as Link, Zelda's distinct abilities make for a fairly different experience. Selecting an Echo is clunky at times, but each can be used creatively as a solution to a myriad of clever puzzles. Performance leaves something to be desired, but the princess' first outing as protagonist is a strong one.",0.87,6
