review,score,game_id
"Like with the Legend of Zelda: Tears of the Kingdom, Baldur's Gate 3 feels like an impossible video game. Everything it does flies in the face of modern gaming and it fulfils almost all of its goals with a tactician's precision and clarity. From its stellar story with hundreds, if not thousands, of meaningful choices and consequences which make every single playthrough special, to the deep and compelling combat which you can spend an age learning, to its impeccable world and sound design, Baldur's Gate 3 is truly something special. While it isn't perfect and stumbles here or there, especially in terms of bugs and technical performance, it would be a crying shame for anyone to miss out on a masterpiece like this. Baldur's Gate 3 is my personal game of the year and I beg everyone who is even remotely interested to try it out.",1.0,1
Baldur’s Gate 3 is a modern RPG masterpiece that has surpassed all of our considerable expectations. A landmark moment for the RPG genre and a game that will forever be remembered for pushing the genre forward.,1.0,1
"The developers at Larian Studios have created something very special with Baldur's Gate 3. And even if developers of large studios fight tooth and nail against it: This role-playing game sets new standards, and future RPGs will have to be measured against it. It is a video game in its purest form that holds a mirror up to the industry. It shows us how video games used to be and how they should be, something the industry has forgotten far too often. It is a work of art, born from the passion and love of a studio that has not been corrupted by the industry's rampant greed. You can tell in every fiber of Baldur's Gate 3 that it wasn't created to generate maximum revenue. Instead, it is a product of the love for video games that characterizes Creative Director Swen Vincke and his team.",1.0,1
"Baldur’s Gate 3 is a new benchmark for what RPGs can be. Its wealth of variety in how its story can unfold, and the insane amount of options for how players can approach different combat and exploration scenarios, make it a must play for just about anyone. It wouldn’t be a stretch to say this is the kind of game we’ll still be talking about 10 years from now, and it more than earns this feat.",1.0,1
Baldur’s Gate 3 gracefully spins atop a tightrope guided by dice rolls as it delivers the player-driven excellence of a tabletop road trip.,1.0,1
"With crunchy, tactical RPG combat, a memorable story with complex characters, highly polished cinematic presentation, and a world that always rewards exploration and creativity, Baldur's Gate 3 is the new high-water mark for CRPGs.",1.0,1
"Playing Baldur’s Gate 3 is an exercise in wonder. How could anyone manage to make a game of this scope, execution, and quality? It’s thrilling, it’s emotional, and it’s incredibly wacky, all at the same time. The sense of freedom and reactivity is unlike anything I’ve played for years, maybe even ever. and all of that is only heightened by a world that feels simultaneously whimsical and horrifying. Baldur’s Gate 3 is a game we’ll be looking back on for years to come.",1.0,1
Larian perfects its own formula for Baldur's Gate's return and delivers the best CRPG around for veteran and newcomers. This is certainly a feat we will be talking about for the next ten years.,1.0,1
"Baldur's Gate 3 is the pinnacle for RPG games that puts the ""Role Play"" back in Role Playing Games. Larian Studios sets a new industry standard that is beyond what we've seen in terms of gameplay, replayability, and graphics. The endless possibilities create the true feeling of an open world that doesn't lead you in a way and gives the player a way to explore the story in limitless opportunities.",1.0,1
"Simply put, Baldur’s Gate 3 is a masterpiece. Larian Studios has done such a phenomenal job at bringing back an IP that has laid dormant since 2000 (2013 if you count the Baldur’s Gate 2 remaster – I, do not) and inadvertently put out a game that spits in the face of contemporary, predatory game design. While I don’t think it will be the new standard of RPGs, I think it stands as an example for aspiring RPG developers that, when given the appropriate amount of time, an RPG does not have to conform to the lifeless norms that the AAA industry has fed us for so many years. Larian, you have truly outdone yourselves, and your work will more than likely stand as one of the greatest achievements in gaming.",1.0,1
"Baldur’s Gate 3 is a dream come true for old-school fans of the Dungeons &amp; Dragons tabletop franchise, and it reinvigorates the entire sub-genre. It’s long, bold, and full of exploration and worth every second of your time.",1.0,1
"Baldur's Gate 3 rolls a natural 20 in all aspects. From the characters and story, to the gameplay and graphics, I highly enjoyed my time with Larian Studios' latest title, and I'm still playing and discovering things to do. Despite the few criticisms, none of them overshadow the incredible things this game achieves.",1.0,1
"Baldur’s Gate 3 is a masterpiece. Games like this don’t come along often, experiences that capture the zeitgeist so profoundly as to provoke scurrilous rumours that Larian Studios would come under legal action for making a game considered too good. From narrative to level design, combat to quests, character creation to romance, everything is fine-tuned to provide a gripping experience that provokes wonder and joy.",1.0,1
Baldur's Gate 3 is an incredible RPG for PC and PS5 that's true to the Dungeons &amp; Dragons experience as well as the sheer possibilities that tabletop games allow.,1.0,1
"Larian has made a truly special game that will be talked about for years. It’s not only probably the best game in a year full of contenders, but it’s one of the best RPGs in a decade. ",1.0,1
"Baldur's Gate 3 masterfully blends gameplay, story &amp; music with incredible player agency &amp; emotional tension, a true gaming masterpiece.",1.0,1
"Baldur's Gate 3 is a masterpiece of the RPG genre, an incredible journey full of epic, great characters and adventure.",1.0,1
"Baldur's Gate 3 is an incredible game, full of player-driven choices and expressive combat that appeals to creativity. It is a deep, flexible and immersive title capable of telling a gripping story that invites replayability. Larian Studios has brought to life a proposal that everyone, even those responsible for the original two installments, can certainly enjoy.",1.0,1
Baldur's Gate 3 is a staggering CRPG with a level of player freedom that make its possibilities feel endless.,1.0,1
"Absolutely highly recommend. If you were a fan of the originals… jump in without fear of being disappointed. If you are new to CRPGs, grab a copy and start here… it’s layered but you can explore at your own pace and learn as you go… easy to start, not too tricky to “master”… or at least manage.",1.0,1
,1.0,1
"Baldur's Gate 3 leaves you with as many ideas it it does memories. That, surely, is the soul of roleplaying. [Issue#389, p.98]",1.0,1
"Baldur's Gate 3 is a fantastic fantasy RPG that will be sure to take hundreds of hours of your time as you explore the world, delve deep into the plot, and enjoy countless other side activities. It looks fantastic, plays fantastic and is just all-round fantastic. ",1.0,1
"The scope of Baldur’s Gate 3 is scandalously large and, what’s more, Larian Studios manages to make good on every detail. It’s up there with the greats, an adventure that any avid role-player will revel in, and one that few will ever regret embarking on.",1.0,1
"Baldur's Gate 3 manages to pull off the spontaneity and unpredictable nature of a long-stretching Dungeons and Dragons tabletop game. The story is intriguing with beautifully woven side quests but never feels like it's forcing you in a set moral direction. You can be as lawful good, or chaotically evil as you wish from scene to scene, and the game will be a different experience for each and every player. Character voice acting, motion capture, and a spellbinding soundtrack make the game world feel alive and the storytelling compelling. The only limit to your experience is your imagination and creativity, and while the sheer volume of possible outcomes can lead to bugs and occasional immersion-breaking moments, Larian has ultimately achieved its ambition for a generation-defining RPG.",1.0,1
"BG3 is a highwater mark for choice-driven RPGs and the new standard to which basically every other major RPG will be compared. I feel bad for Starfield at this point and for game developers in general. Larian Studios has set the bar incredibly high. Still, I hope other publishers will see it as an example to let developers have time and creative freedom to make incredible games without all the bloated live service and microtransaction bullshit. Also, you can play this game in four-player online co-op or even split-screen locally on a single PC, and in this day and age, that may be one of the most impressive features in BG3. If you love RPGs, you owe it to yourself to play this game. ",1.0,1
"In case you couldn’t tell, I f.cking love this game....Baldur’s Gate 3 is truly exemplary, one of the few videogames in history that wholly deserve the universal acclaim heaped so freely upon releases above a certain marketing budget. The choices offered to the player in terms of both crafting an adventurer and influencing the story do an incredible job of translating Dungeons &amp; Dragons to a form of interactive software that surpasses the loftiest expectation. The script is incredible, the gameplay beneath it downright luxurious. There won't be another like this in a long, long time. ",1.0,1
"Near the end of Baldur's Gate 3, a character says, ""Too much freedom can be frightening."" It's a powerful line within the context of the story, but it also speaks to Baldur's Gate 3 on a deeper level. The freedom that it offers is unprecedented, and it takes a little while to really see the scope of what that means for the game. At times, the sheer number of choices and consequences can be overwhelming. But before long, it becomes apparent that Baldur's Gate 3 allows players to be the authors of their own destinies in a way no other game has before. It's that freedom and reactivity paired with its excellent presentation and fantastic characters that really set Baldur's Gate 3 apart, and it's why after 200 hours I'm still coming back to it. Too much freedom can be frightening, but Larian trusts its players to make the most of it, for better or for worse.",1.0,1
It's a game of the year contender. Easily.,1.0,1
"Larian Studios has tapped into the Weave and conjured up a near-impossible miracle, bringing the creativity of Dungeons &amp; Dragons to life in Baldur’s Gate 3. Players are given real agency to pursue the narrative in a way that suits them and to dive into combat and experiment with a dizzying number of options. Baldur’s Gate 3 is a truly phenomenal game that has managed to sweep up the imaginations and dreams of players and developers alike. Baldur’s Gate 3 may just go down as one of the greatest games of all time.",1.0,1
"Baldur’s Gate III is a title that many would not have thought possible just a few years ago. The game serves to further Larian Studios’s already strong reputation, and the studio deserves massive credit for refusing to panic, taking its time to get things right, and continuing to offer improvements even after launch at an impressive rate. Hopefully, it is able to reap the richly deserved rewards for doing so.",1.0,1
"Larian Studios, the creators of the latest installment, have gone to great lengths to make sure they didn't disgrace any of the franchise's building blocks. The love and care is evident in Baldur's Gate 3, though needless to pretend, there aren't a few bricks crumbling here and there in this monument. It's far from a perfect title, but on the whole Baldur's Gate 3 is a brilliant computer RPG that is undoubtedly not to be overlooked. [Issue#329]",1.0,1
"Baldur's Gate 3 is incredible, proof that in 2023 it is still possible to be amazed by a video game. It is deep, flexible, and engaging, but most importantly, it is able to tell an immersive story dictated by the player's smallest choices. Pioneers like Richard Garriott or Robert Woodhead can finally breathe a sigh of relief and enjoy a well-deserved retirement, because their legacy is safe in the hands of Larian Studios.",0.99,1
"If you’re an RPG fan, get Baldur’s Gate 3. Now. It’s one of those titles that feels like a ‘once in a century’ experience. Its systems are deep while being rewarding and thrilling to master. Its narrative is bold, exciting, and at times, devastatingly heartbreaking. Though – to BG3’s credit – the writing never gets to the point of being overly complicated and full of itself. Even if you don’t consider yourself an RPG fan, you must play it. Baldur’s Gate 3 is that good. It’s a rare achievement that will sit in the discussion of the greatest games ever made for the rest of time. Bravo to Larian Studios for crafting a genuine work of art.",0.99,1
"This is a masterpiece that is going to change RPGs forever, a new-flawless experience that shows what a role-playing video game should be in 2023.",0.98,1
"It's basically a game that recalls the real joy of RPG that people forgot. In Baldur's Gate3, you can do pretty much everything as much as however you like. At the end of the game, the only thing left there was simply a gratitude to Larian Studios for making this exceptional journey.",0.98,1
"Larian Studios' magnum opus. A pinnacle of RPG design that merges depth, uniqueness and writing of the best cRPGs with production quality and audio-visual presentation of AAA games. It is a new high for the video game industry.",0.98,1
"Recent cRPG releases have revitalized the genre and proven that a great single-player game can gather a huge passionate playerbase, no microtransactions or live service elements needed. If you enjoy narrative-driven RPGs that feature deep roleplaying systems and a cast of great characters, you owe it to yourself to give Baldur’s Gate 3 a chance. I have not felt such a rush of emotions since Dragon Age: Origins.",0.97,1
Baldur's Gate 3 is an unrivalled RPG that will swallow your life whole.,0.97,1
"Following a long development and early access phase by developer Larian Studios, Baldur's Gate 3 offers an engaging story and immersive gameplay set in the world of Forgotten Realms. Decide the fate of the magical world.",0.97,1
"Baldur's Gate III is an amazing game. While the length can be intimidating and the lore vast - that makes it all the more compelling and the game could easily become one of the biggest time sinks for gamers since the likes of Elder Scrolls V: Skyrim or Elden Ring released. If you're a fan of Larian Studios' previous work, DND, strategy RPGs, or any of the above, BG3 is almost certainly the game for you, and comes highly recommended.",0.97,1
"Baldur's Gate 3 is an outstanding role-playing game, both in terms of its gameplay and its technical aspects (still with areas to be polished via patch), one that, moreover, is destined to become one of the benchmarks of the genre for taking some ideas, such as the election system and its reactive world, to a level that others have not even dreamed of. ",0.96,1
"It's difficult to imagine just how much effort and passion Larian Studios put into Baldur's Gate 3 to create such a groundbreaking masterpiece. As the first sequel in two decades, it successfully continues the legendary story of Baldur's Gate. With exceptional freedom and intricate combat mechanics, it opens up the possibility for more people to enjoy the unique appeal of DND. It overshadows all the games I've played this year and gives us a CRPG experience like no other.",0.96,1
"Baldur's Gate 3 is the best DnD RPG we've ever seen on our screens, and a triumph of RPG design that will surely set new standards for the genre as a whole.",0.96,1
"Baldur's Gate III is not entirely without flaws, and they tend to become more noticeable in the game's last act (especially when it comes down to optimization), but none of that change the fact that we are dealing with a CRPG masterpiece and Larian's crowning achievement after an already long and quite successful career. Weather you are a returning fan or a new one, there is almost no reason to not give this one a go, if you are passionate about computer role-playing games.",0.96,1
"With its engaging story, charming characters, extremely dynamic world that constantly reacts and adapts to the player's actions and choice and a solid tactical combat system, Baldur's Gate 3 is among the best cRPGs ever released. A wonky interface, the lack of some quality-of-life features and Larian Studios' trademark save scumming design impact the experience, but they're only minor issues that don't away too much from the whole experience. After years in development, Baldur's Gate 3 definitely exceeded all expectations, and in the best possible way.",0.95,1
"I can’t help but compare it to a great session of Dungeons and Dragons with your friends, it's something that when done correctly will stay with you long after you have finished a play session. The team at Larian Studios are to be commended, Baldur’s Gate 3 is nothing short of a masterpiece when it comes to RPG’s.",0.95,1
"Baldur’s Gate 3 breaks through the recent dirth of huge narrative RPGs to deliver something incredible. It’s an outstanding achievement that will stand the test of time even as we move into the next generation of gaming. It’s a masterpiece in both design and implementation, with only some pervasive performance issues and gameplay bugs to sometimes drag the experience down. Still, the narrative, graphic design, voice performances, and tactical gameplay do a lot to bring the experience back up to amazing.",0.95,1
"A mind blowing game, that consecrates Larian Studios as one of the greats of the RPG genre, and will probably have the same impact today that its predecessors had in their age. It's a superb and brilliant game, that we wholly recommend to anyone who loves the genre, or deep video games in general.",0.95,1
"Baldur's Gate 3 is the best RPG in years. The game is not made for everyone and has a steep learning curve, especially for non-D&amp;D players. But those willing to dive in will find a game that offers you more freedom of choice than we've ever seen in peers.",0.95,1
"Baldur's Gate 3 deserves the title of Game of the Year, plain and simple. Having sunk around 100 hours into the game since its launch, and with the city of Baldur's Gate still a distant sight, it's a challenge to tear myself away from the captivating narrative I've woven. Both my impressions from the early access phase and my time with the full release have remained consistent: the game is a masterpiece.",0.95,1
"Larian has built one of the most intricate virtual worlds I’ve ever seen and, despite a few hiccups, Baldur’s Gate 3 remains the finest example of its genre available today.",0.95,1
"What to say, what to do... if not to bow humbly in front of so much talent. Larian Studios once again proves its expertise in the field of role-playing games and even manages to sublimate the rich and complex universe of Dungeons &amp; Dragons. Baldurs' Gate 3 is quite simply the best D&amp;D video game adaptation ever made. This adventure “of which you are the hero” shines with its generosity, its mastery of the codes of the genre and this constant desire to surpass oneself. BG3 can boast of being the ultimate video game experience for role-players, but not only. Admittedly, this RPG requires a good PC to play in optimal conditions and proves to be a bit tough to learn, especially for the uninitiated. But to play Baldur's Gate III is to create your own story, a story that belongs only to you. Just for that (and more), the pleasure is total!",0.95,1
"Baldur’s Gate 3 is unforgettable and one of the best experiences I’ve had in games. I may have just finished my lengthy first playthrough, but I’m already eager to delve further and push the boundaries of what’s possible in this exceptional world that Larian created.",0.95,1
"Ultimately Baldur's Gate 3 is, in no uncertain terms, a shining jewel of design and programming, so deep, layered and sumptuous that it can be considered the new golden standard of the genre: a benchmark of prodigious magnitude that will be a real nightmare for anyone want to embark, in the future, on the development of titles belonging to the same category. Where many would have crashed to the ground by replicating the myth of Icarus and the Sun, Larian Studios triumphs and brings a sequel to PC that in many ways even surpasses its illustrious predecessors. In short, the throne of the best RPG of the generation has just been claimed.",0.95,1
"Faerûn is a unique world. The story of Baldur's Gate 3 is outstanding. Coupled with gameplay that knows how to effectively mix the turn-based system with its exploration in real time. A ten music that manages to transport us to a fantasy environment that has a looming danger. The building of relationships, the enemies and the dangers that we will find in Faerûn, make this Larian adventure almost 100% complete. A game that will go down in history and remain in the hearts of millions of players forever. Highly recommended.",0.95,1
"I could easily keep talking about this game, from the romance scenes that honestly had a lot of heart put into them or about various small encounters that I had just roaming around the map. Baldur’s Gate 3 may not be a one-to-one recreation of a system that many of us know, but that doesn’t hold it back in any form. Instead, the spirit of Dungeons &amp; Dragons is inside the very fiber of Baldur’s Gate 3; it can sometimes be silly and outlandish. However, there is a lot to love here, and there aren’t many words that could really convey how much I love this game and glad that while the battle system may not be what I expected, once I adjusted myself to it, it gave me almost everything else I could want out of a game.",0.95,1
Baldur's Gate 3 is an exceptionally well-written game with breathtaking visuals and charming NPCs. The game's combat is creative and allows all sorts of maneuvers that you can think of. Larian Studios's CRPG shows that the genre can be accessible and brings the best out of Dungeons &amp; Dragons: a universe of peculiar beings that unite under a greater good.,0.95,1
"We praised Larian a lot for  Divinity: Original Sin 2, but Baldur's Gate 3 is without a doubt their masterpiece. It's an experience that deserves its name in every sense and trilogizes the Baldur's Gate saga in a spectacular way. If it makes up for its shortcomings with an Enhanced Edition, we can easily call it one of the best games of the 2000s.",0.95,1
"Fans of cRPG couldn't have hoped for a better sequel of one of the most revered franchises in the history of this genre. Larian Studios should be proud for setting new standards, creating a  highly ambitious reactive world filled to the brim with quality content, accompanied by a deep combat system and excellent writing.",0.95,1
"There are good games and great games, and then there are games that change the game entirely. Baldur’s Gate III is that rare case that charts its own route, building on the best of what came before it and breaking new ground. With how responsive the game is to the specifics of your created character, it could be explored virtually forever with endless new stuff to discover tucked into millions of little corners. The world is intricate and wonderous enough to want to live in it, and the characters are so intriguing that you cherish every conversation and want to save them all from themselves (and good luck doing that!). It’s an explosion of the imagination so powerful that it’s unthinkable that Larian was able to fit it all into one game, but they did. So, gather your party and venture forth!",0.95,1
"An incredible detailed and large game, Baldur's Gate 3 is a joy for RPG fans and fans of the pen and paper game as well.",0.95,1
"Baldur's Gate 3 is an epic game, not so much for any individual element, but rather for the sum of its parts. The result is certainly what fans have been waiting for for far too many years. Great job, Larian.",0.93,1
Baldur’s Gate 3 is a great adventure that's fun to be in. I adore this game despite all the potential pitfalls. Its freedom and possibilities really stand out – I think the only game that could rival this RPG would be Fallout: New Vegas.,0.9,1
"Baldur’s Gate 3’s world is beautiful, layered, and complex, and challenges you to attack it how you want. The story is compelling, giving your decisions a weight rarely seen in games of this scope. It is a marvel, and easily one of the best RPGs ever made. ",0.9,1
A brilliant and impressive journey that adapts to your every move.,0.9,1
"An excellent follow-up to its decades-old predecessor, Baldur's Gate III sets a new gold standard for RPGs in the modern age. Though it has its fair share of buggy problems, the vibrant world, intriguing storytelling, and captivating gameplay more than make up for its shortcomings.",0.9,1
"An incredible achievement in role-playing game design, in terms of the level of freedom and interactivity – although even ignoring the bugs it’s not quite as consistent as you might hope.",0.9,1
"It has heart, it has style, and it has the multi-year effort of a studio that obviously loves its source material. The mind-blowing size of the game itself and everything contained within is a testament to Larian Studios' dedication to its craft and commitment to bringing something incredible to the gaming public.",0.9,1
